{
  "schema_version": 1,
  "attempt_id": "11111111-1111-4111-8111-111111111111",
  "purpose": "todo1-kickoff",
  "creation_boot_id": "22222222-2222-4222-8222-222222222222",
  "recovery_boot_id": null,
  "proof_sha256": "aaaaaaaaaaaaaaaaaaaaaaaaaaaaaaaaaaaaaaaaaaaaaaaaaaaaaaaaaaaaaaaa",
  "parent_path": "/sys/fs/cgroup/user.slice/clinic.scope",
  "parent_device": 1,
  "parent_inode": 100,
  "child_path": "/sys/fs/cgroup/user.slice/clinic.scope/clinic-probe",
  "child_device": 1,
  "child_inode": 110,
  "state": "removed",
  "expected_parent_pid": 1000,
  "probe_pid": 1001,
  "probe_pgid": 1001,
  "probe_start_ticks": 5000,
  "probe_barrier_released": true,
  "removal_kind": "rmdir",
  "removed_at_utc": "2026-07-16T12:00:02.000000Z",
  "updated_at_utc": "2026-07-16T12:00:02.000000Z"
}
