{
  "attempt_id": "11111111-1111-4111-8111-111111111111",
  "child_device": 1,
  "child_inode": 110,
  "child_path": "/sys/fs/cgroup/user.slice/clinic.scope/clinic-probe",
  "creation_boot_id": "22222222-2222-4222-8222-222222222222",
  "expected_parent_pid": null,
  "parent_device": 1,
  "parent_inode": 100,
  "parent_path": "/sys/fs/cgroup/user.slice/clinic.scope",
  "probe_barrier_released": null,
  "probe_pgid": null,
  "probe_pid": null,
  "probe_start_ticks": null,
  "proof_sha256": "aaaaaaaaaaaaaaaaaaaaaaaaaaaaaaaaaaaaaaaaaaaaaaaaaaaaaaaaaaaaaaaa",
  "purpose": "final-input-freeze",
  "recovery_boot_id": null,
  "removal_kind": null,
  "removed_at_utc": null,
  "schema_version": 1,
  "state": "remove-intent",
  "updated_at_utc": "2026-07-16T12:00:01.000000Z"
}
